{
  "$schema": "https://raw.githubusercontent.com/liqms/wrisp/main/resources/schemas/skill.schema.json",
  "id": "polish",
  "name": {
    "zh": "润色",
    "en": "Polish"
  },
  "description": {
    "zh": "优化文本表达，提升语言质量和流畅度，使文本更加优美、准确和易读",
    "en": "Refine the wording to improve language quality and fluency, making the text more elegant, accurate, and readable"
  },
  "icon": "✨",
  "version": "1.0.0",
  "author": "Wrisp Team",
  "category": [
    "editing",
    "polish"
  ],
  "tags": [
    {
      "zh": "润色",
      "en": "polish"
    },
    {
      "zh": "精炼",
      "en": "refine"
    },
    {
      "zh": "风格",
      "en": "style"
    },
    {
      "zh": "提升",
      "en": "improve"
    }
  ],
  "enabled": true,
  "promptTemplate": {
    "zh": "请润色以下文本，使其更{{style}}：\n\n{{text}}\n\n要求：只输出润色后的结果，不要添加任何解释。",
    "en": "Please polish the following text to make it more {{style}}:\n\n{{text}}\n\nRequirements: Output only the polished result, without any explanation."
  },
  "systemPrompt": {
    "zh": "你是一个专业的文本润色助手，擅长优化中文表达。",
    "en": "You are a professional text polishing assistant skilled at refining expression."
  },
  "input": {
    "type": "object",
    "properties": {
      "text": {
        "type": "string",
        "description": {
          "zh": "需要润色的文本",
          "en": "The text to polish"
        }
      },
      "style": {
        "type": "string",
        "enum": [
          "professional",
          "concise",
          "vivid",
          "formal",
          "casual"
        ],
        "default": "professional",
        "description": {
          "zh": "润色风格",
          "en": "Polishing style"
        }
      }
    },
    "required": [
      "text"
    ]
  },
  "output": {
    "type": "text"
  },
  "preProcess": [
    {
      "type": "trim"
    }
  ],
  "example": {
    "zh": {
      "input": {
        "text": "这个想法挺好的。",
        "style": "professional"
      },
      "output": "这个想法非常出色，值得深入探讨。"
    },
    "en": {
      "input": {
        "text": "This idea is pretty good.",
        "style": "professional"
      },
      "output": "This idea is outstanding and well worth exploring in depth."
    }
  }
}
